xh,association_name,leader_name,leader_phone,leader_post,association_address,area_code,is_register,karma_create_time
7,宜昌市肢残人协会,杜江勤,0717-6240821,副主席、秘书长,湖北省宜昌市西陵区云集街道桃花岭8号,420502094992,1,2025-09-10 15:06:39.0
8,宜昌市盲人协会,屈克兵,0717-6221132,主席,西陵区桃花岭8号,420502094992,1,2025-09-10 15:06:39.0
9,宜昌市聋人协会,杨镜,0717-6229579,主席,西陵区桃花岭8号,420502094992,1,2025-09-10 15:06:39.0
10,宜昌市智力残疾人及亲友协会,刘立念,0717-6240821,主席,西陵区桃花岭8号,420502094992,1,2025-09-10 15:06:39.0
11,宜昌市精神残疾人及亲友协会,潘峰,0717-6221132,主席,西陵区桃花岭8号,420502094992,1,2025-09-10 15:06:39.0
12,宜昌市残疾人体育协会,杨意,0717-6240302,主席,西陵区桃花岭8号,420502094992,1,2025-09-10 15:06:39.0
13,宜昌市残疾人文学艺术协会,汤斌斌,0717-6240861,主席,西陵区桃花岭8号,420502094992,1,2025-09-10 15:06:39.0
35,伍家岗区肢残人协会,史晓露,0717-6853992,协会秘书长,宜昌市伍家岗区白马山路8号伍家岗区残疾人康复中心2楼,420503004003,,2025-09-10 16:40:44.0
