xh,pcrq,xmqy,xmmc,jsdw,sgdw,jldw,sbly,bz
1,2024年第二十六期,宜都市,湖北宜化楚星生态科技有限公司175万吨/年磷石膏净化无害化处理项目,湖北宜化楚星生态科技有限公司175万吨/年磷石膏净化无害化处理项目,中国机械工业第二建设工程有限公司,湖北菲迪克工程管理咨询有限公司,项目现场管理规范有序，高标准设置工地大门、围挡，常态化落实安全文明标准化施工要求，场内道路、雨污水管网采用永临结合。裸土全覆盖，太阳能路灯及喷淋一体化设施常态化使用；内外脚手架均采用承插型盘扣式脚手架，搭设规范美观；高标准做好临边防护措施，确保安全生产。,
2,2024年第二十六期,猇亭区,古老背路安置房（B1、B8 及 3#、4#）工程,宜昌市猇亭工业园投资开发有限公司,湖北盛荣建设集团有限公司,济南市建设监理有限公司,现场采用一体化装配式办公室，办公区绿化充足、大方美观；场内材料分类堆码有序，喷淋强劲有力，道路干净整洁；主体采用爬架铝模封闭式施工，安全可靠，混凝土成型观感良好，场区安全通道使用定型化材料搭设配备太阳能灯照明，绿色节能。,
3,2024年第二十七期,宜都市,宜都市瑞霆房地产开发有限公司中建·时代都汇项目,宜都市瑞霆房地产开发有限公司,"中建三局集团有限公司
湖北国通领驭建设集团有限公司
湖北交投耀栋建筑有限公司",湖北大靖建设项目管理有限公司,人员进出采用实名制人脸识别，扬尘监控系统实时在线，喷淋系统运行正常，现场定型化防护使用全面，材料堆场分类堆码，现场裸土覆盖全面；现场道路干净整洁，楼栋外立面密目式安全网挂设全面，踢脚板设置完善；市政绿化整体外观形象好。,
4,2024年第二十七期,当阳市,当阳城市更新项目（一期）新建项目EPC工程总承包,当阳市建投宜居住房建设有限公司,湖北华欣城建工程有限公司,湖北建盛工程项目管理有限公司,高标准围挡封闭施工，采用定型化防护措施；办公区及主道路一侧布置绿化，施工现场未施工裸土全覆盖，严格落实扬尘治理“10个100%”要求。,
5,2024年第二十七期,高新区,宜昌人福国际高端麻精药品智能产业基地项目国际运营中心,宜昌人福药业有限责任公司,坤发建筑有限公司,武汉星宇建设咨询有限公司,安装工程采用BIM优化设计，空间利用充分，布置合理，支吊架采用综合支架，安装效果好。地下室加腋顶板不规则角度阴角涂料施工，采用定制成品线条过度，施工方法创新，阴角顺直，美观大方。屋面女儿墙泛水弧采用公司自主研发的装配式泛水弧技术，整体效果美观，质量可靠。,
6,2024年第二十七期,点军区,长江水文宜昌科创中心项目主体工程,宜昌市禹王水文科技有限公司,湖北盛荣建设集团有限公司,湖北灼宜工程项目管理有限公司,工地大门围挡设置标准美观，实名制通道设置到位；场区内干净整洁，材料堆放整齐有序，外架防护网使用定型化冲孔钢板网，安全防护到位，内架均使用盘扣式模板支撑体系，使用定型化防护栏杆和定型化卸料平台，整体外观形象好。,
7,2024年第二十七期,西陵区,西湖路与峡州大道交会处居住项目,宜昌领投置业有限公司,"中国化学工程第十六建设有限公司
湖北三峡路桥工程有限公司
中国机械工业第二建设工程有限公司",湖北中业宏工程咨询有限公司,门前“四包”执行到位，围挡周边常态化维持良好状态；场内环境整洁干净，降尘举措扎实落实；楼层临边防护符合规范，安全防护设施实现定型化。,
8,2024年第二十七期,西陵区,市住新局食堂及危墙维修项目,宜昌市市直机关国有资产服务中心,湖北华柯建设工程有限公司,,施工组织合理有序，各工种配合协调；措施完备，保障有力，执行高效，努力将施工对周边居民生活和单位办公造成的影响降到最低；质量控制严格，注重成品保护，细部处理到位。,
